text,label
Where Is the top up verification code found?,verify_top_up
Is it possible for me to get money out in a different currency?,receiving_money
Please explain why the funds I added were returned to my account.,top_up_reverted
I need a new card and I live in the United States.,country_support
Where did this extra €1 fee on my statement come from?,extra_charge_on_statement
Is it possible to use my apple watch for topping up?,apple_pay_or_google_pay
Can I submit a check or cash payment?,top_up_by_cash_or_cheque
I seem to be unable to make any transactions.,card_not_working
How do I go about ordering a new bank card?,card_about_to_expire
I withdrew  money from the ATM and was overcharged.  It said nothing about an extra fee.,wrong_exchange_rate_for_cash_withdrawal
My transaction is still showing that is pending from my cash withdrawal.,pending_cash_withdrawal
Am I able to exchange currencies?,fiat_currency_support
"I would like to get a physical card, but I don't know how. Can you help me?",order_physical_card
My card has been charged two separate times for a single transaction.,transaction_charged_twice
How might  I change my PIN?,change_pin
I withdrew cash and was charged. Why?,cash_withdrawal_charge
I have forgotten my passcode to access my app,passcode_forgotten
There are funds in my app that I did not receive.,cash_withdrawal_not_recognised
"I really need money from my card today, but my card is getting declined. Please help!!",top_up_failed
When will I see my new balance after making my bank transfer?,balance_not_updated_after_bank_transfer
"I tried to get money out of an ATM in Notting Hill earlier, but it didn't work. Is my card actually working? It's the first time I tried using it",declined_cash_withdrawal
What are my remedies if I think I was charged twice for the same expense?,transaction_charged_twice
What are the current exchange rates?,exchange_rate
I got charged and extra fee when I transferred money so why was I charged?,transfer_fee_charged
Are there any fees for adding money with an international card?,top_up_by_card_charge
I need several cards per day. And I need to be able to throw away all of the cards I make.,disposable_card_limits
What currencies is an exchange rate calculated in?,exchange_rate
I just lost my wallet and I think someone is using my card to withdraw my money. Can you please cancel or freeze my card?!!,cash_withdrawal_not_recognised
"My phone was stolen, what should I do first?",lost_or_stolen_phone
I would like to know how much I can top-up.,top_up_limits
My card expires soon,card_about_to_expire
My card payment wasn't declined,declined_card_payment
Can my children have their own account?,age_limit
"I am unhappy with my purchase, how do I cancel the order?",request_refund
is there a limit on top ups,top_up_limits
Why is the check I deposited this morning not showing up?,balance_not_updated_after_cheque_or_cash_deposit
How do I validate my identity.,verify_my_identity
I made a transaction this morning but I need to revert it now.,cancel_transfer
What are the charges for US cards with top up.,top_up_by_card_charge
I made a cash deposit to my account but it is not there,balance_not_updated_after_cheque_or_cash_deposit
How to change my address.,edit_personal_details
What options do I have when topping up a US card?,top_up_by_card_charge
I lost my phone and would like to freeze my accounts.,lost_or_stolen_phone
How do I reset my PIN?,pin_blocked
The correct amount of cash was not received.,wrong_amount_of_cash_received
Is there a problem with your system being down or something? I have already tried 5 times to issue a standard transfer but I'm getting nowhere.,failed_transfer
The transfer was accepted but now it's stuck on pending. When will it go through?,pending_transfer
Is there a charge for a foreign currency exchange?,exchange_charge
I need to cancel a transaction on my debit card.,direct_debit_payment_not_recognised
Where can i find my top-up verification code?,verify_top_up
Why am I not able to verify my id?,unable_to_verify_identity
Why hasn't my top-up gone through?,pending_top_up
"I got my American Express in Apple Pay, why is top up not working?",apple_pay_or_google_pay
There has been a red flag on my top up.,top_up_failed
Why is it showing that my account has been charged a dollar that is showing as pending?,extra_charge_on_statement
Who can I speak with regarding a lost card?,lost_or_stolen_card
The application reverted my top-up.,top_up_reverted
"$1 extra has been charged on my statement, why is that?",extra_charge_on_statement
Can I choose between Visa and Mastercard?,visa_or_mastercard
"phone is at a hotel, can i still use app",lost_or_stolen_phone
Why won't my top up go through?,top_up_reverted
How much time do transfers typically take? I sent money to a friend who needs it urgently. It's been hours and has not gone through.,transfer_not_received_by_recipient
"My card will expire soon, do I need to order a new one?",card_about_to_expire
My transfer's stuck on pending.,pending_transfer
I was wondering if you will take any fees in exchange for top ups?,top_up_by_card_charge
I submitted my transfer but it has been pending for quite a while and I was wondering what takes so long? why hasn't it completed,pending_transfer
My latest payment was declined! What happened! I was told everything had been resolved and was back to working order again.,declined_card_payment
How do I unblock my card using the app?,card_not_working
I have a fee showing from last time I used my card.,card_payment_fee_charged
"I saw on the app that a cash withdrawal was completed on my account; however, I did not complete it.",cash_withdrawal_not_recognised
Can you tell me where you get your exchange rates?,exchange_rate
I made a mistake this morning when I did a transfer. How do I reverse it?,cancel_transfer
I placed a cheque but the funds aren't there,balance_not_updated_after_cheque_or_cash_deposit
Is it possible to exchange currencies on the app?,exchange_via_app
"This company isn't good, I would like to delete my account.",terminate_account
top up did not complete,pending_top_up
where did my funds come from?,verify_source_of_funds
What services can I use to top up?,apple_pay_or_google_pay
"I've got a problem - I purchased an item maybe a week or two ago, but to the payment came back to my account! I've already got what I ordered, so why are the payment funds showing up in my account?",reverted_card_payment?
"I noticed an extra $1 charge on my statement, can you tell me why that is?",extra_charge_on_statement
Is there an additional charge to exchange currencies?,exchange_charge
"I got cash from an ATM earlier but it shows up as pending in the app. How can this still be pending, I already received the cash?",pending_cash_withdrawal
how do i set up my apple pay watch to connect to my account,apple_pay_or_google_pay
The card can be used at which ATMs?,atm_support
why hasn't a transaction to a friend cleared yet?,transfer_not_received_by_recipient
I don't know where a direct debit payment came from,direct_debit_payment_not_recognised
Why is  my  top  up for  my  new account  not  instant,pending_top_up
Why haven't I gotten my new card?,card_arrival
Why did I get charged more than once?,transaction_charged_twice
Do you deal with EUR?,fiat_currency_support
i need to expedite my card,card_delivery_estimate
How do I troubleshoot Google pay top up?,apple_pay_or_google_pay
What kind of foreign exchange rate will I get when I exchange my money?,exchange_rate
You accepts my card?,card_acceptance
"Sort your top up out please! It's been pending since an hour already, can you please make this go through asap I really need the money",pending_top_up
How long does it take transfers from Europe to complete?,transfer_timing
Can I use this card at an ATM?,atm_support
"My mother deposited a cheque into my account last week, why is it still not showing up?",balance_not_updated_after_cheque_or_cash_deposit
I don't see my top up in my wallet.,topping_up_by_card
How can my new card be activated?,activate_my_card
"I just got a new card, and I want to know how to activate.",activate_my_card
Why hasn't my payment gone through yet?,pending_card_payment
Why is a transfer I have still pending?,pending_transfer
I need to change my account details,edit_personal_details
Why do my transfers keep failing?,failed_transfer
How can I get a physical card,order_physical_card
"I no longer have my phone with the app, what should I do?",lost_or_stolen_phone
MY transfer has still not appeared.,balance_not_updated_after_bank_transfer
Why has my money disappeared? I topped up earlier and seen it was there and had went through. What seems to be the problem?,top_up_reverted
Is there any fees associated with receiving money with this account?,top_up_by_bank_transfer_charge
Why am I unable to withdrawal cash?,declined_cash_withdrawal
I used my card to make a payment and wondered why the payment was reverted?,reverted_card_payment?
Change my pin?,change_pin
How is my money transferred to the account,transfer_into_account
Can you tell me the ATMs I can use with my card?,atm_support
I still haven't received my card in the mail,card_arrival
I am not happy with your company. Please delete my account asap.,terminate_account
How do I link a card that I already have?,card_linking
What is the refund policy?,request_refund
A direct debit payment that I didn't authorise shows up in my app.,direct_debit_payment_not_recognised
I am still waiting for a transfer to show up,pending_transfer
I couldnt get cash in an ATM,declined_cash_withdrawal
Why have I been charged a fee for cash withdrawal?,cash_withdrawal_charge
How can I exchange currencies in the app?,exchange_via_app
When will my funds transfer?,transfer_not_received_by_recipient
I attempted to enter my pin to many times.,pin_blocked
I am worried that too much time has gone by for a transfer to be completed.,transfer_not_received_by_recipient
is it possible to top-up with google pay.,apple_pay_or_google_pay
"Hi! I was wondering if you can help me. I used the city centre ATM to get some cash, but the machine declined my card. My account shows that transaction is still pending. I didn't receive the money, so please cancel that transaction.",pending_cash_withdrawal
How do I open up an account for my child?,age_limit
I can't use the app because I got mugged yesterday and they took everything. Please help.,lost_or_stolen_phone
How can i reset my passcode ?,passcode_forgotten
I'm at an ATM and withdrew 30 pounds and was only given 10. What should I do?,wrong_amount_of_cash_received
Are your cards supported in the EU?,country_support
How much does each transfer cost?,top_up_by_bank_transfer_charge
How do I add the card I just received to show up in the app?,card_linking
Help!  The atm won't give me my card back.,card_swallowed
Why do I have to give you all of my identification details?,why_verify_identity
I transferred some money but it is not here yet,transfer_not_received_by_recipient
Seems like my transfer was declined how come?,declined_transfer
Why was my transfer stopped ?,beneficiary_not_allowed
The app doesn't think that I am myself,unable_to_verify_identity
"There was a transaction from two weeks ago from a business that I don't know. I'm fairly certain it wasn't me who made it, but is it an option to trace it to confirm?",direct_debit_payment_not_recognised
The amount of money I pushed at the atm machine did not come out of the machine.,wrong_amount_of_cash_received
My credit card was declined.,declined_card_payment
I made a payment but the app gave the money back.,reverted_card_payment?
A payment shows up on the app that I never made.,card_payment_not_recognised
Which ATMs accept Mastercard?,atm_support
There is a card payment I do not recognise.,card_payment_not_recognised
Can I top up using my cheque?,top_up_by_cash_or_cheque
Can I get a Visa or does it have to be something else.,visa_or_mastercard
How can I put more money into my account?,top_up_by_cash_or_cheque
What can I do if contactless doesn't work?,contactless_not_working
Tell me how a top up would be reverted.,top_up_reverted
"My card payment reverted back, I think.",reverted_card_payment?
How recent do my documents need to be for verification?,verify_my_identity
Will I always be charged a fee for using my card?,card_payment_fee_charged
When do i get charged a fee for using the card?,card_payment_fee_charged
How can I top up by card?,topping_up_by_card
How do I get extra cards?,getting_spare_card
Money transfer help? How long?,transfer_timing
"For physical cards, do you charge?",order_physical_card
my phone was lost,lost_or_stolen_phone
Why should I have to prove my identity?,why_verify_identity
I paid with my card so so why was I charged a transaction fee?,card_payment_fee_charged
Can I add money to my account with cash?,top_up_by_cash_or_cheque
"Fix your system. I can't make transfers, I've tried like 5 times already.",failed_transfer
I don't have my passcode to access the app.,passcode_forgotten
"After I attempted a transfer, it failed.",failed_transfer
Are there limits to businesses that will accept this card?,card_acceptance
Why hasnt my top up gone through yet?? I thought it was suppose to be instant? Am I wrong? Why is it still pending?,pending_top_up
Can I make an account for my kids?,age_limit
Why is my card payment showing as pending?,pending_card_payment
How many disposable cards can I make in a single day?,disposable_card_limits
Why is top up not working for my apple pay app,apple_pay_or_google_pay
Hello I changed my mind and really need a refund on one of things I bought recently. Can you please cancel the transaction and get my money back. Please it's urgent.,request_refund
How long will a transfer from China take? I need to transfer something from there.,transfer_timing
How do I verify my top up?,verify_top_up
"My account is blocked, how do I log in now",pin_blocked
My salary is deposited in GBP. Do I need to choose the currency?,receiving_money
I checked the exchange rate when I withdrew cash. But the actual rate that you applied was different.,wrong_exchange_rate_for_cash_withdrawal
On my last transaction it seem that my top-up was not successful.,top_up_reverted
My transfer failed,failed_transfer
"I tried to withdraw cash, but got declined!",declined_cash_withdrawal
I visited the ATM but got less money than what I requested. Why?,wrong_amount_of_cash_received
Does the card you sent have a tracking number?,card_arrival
How fast can you fix an error in payment?  I made a payment in the wrong account yesterday and it needs to be adjusted by tomorrow for my rent.,cancel_transfer
A percentage fee was charged to my withdrawal.,cash_withdrawal_charge
Why is there a direct debit payment on my statement that I didn't do?,direct_debit_payment_not_recognised
Why is a transaction showing as pending when I recieved cash from an ATM?,pending_cash_withdrawal
what is this charge on my card?,direct_debit_payment_not_recognised
how come my transfer didn't work,failed_transfer
What documents do you need to verify my identity?,verify_my_identity
Why did I get a fee?,cash_withdrawal_charge
I just made a top-up but it shows as pending! I use your service all the time and have never had a problem before. Why does it keep showing up as pending?,pending_top_up
How do I dispute a direct debit on my account?,direct_debit_payment_not_recognised
I am highly unsatisfied with this company and want to delete my account!,terminate_account
What cards to do you support to top up.,supported_cards_and_currencies
I have a new email.,edit_personal_details
How do my friends top up my account,topping_up_by_card
What's going on? My card wont accept any transactions.,card_not_working
Can i cancel a charge?,cancel_transfer
how do I find the code to verify the top up card?,verify_top_up
Why did the ATM give me less money than what I requested?,wrong_amount_of_cash_received
I can't log in,passcode_forgotten
My card payment has been pending for a long time now. Why is it taking so long to take. It should have already made it through.,pending_card_payment
Is the ATM broken? I can't get cash from it.,declined_cash_withdrawal
I have been overcharged. I just changed over Russian Ruble to UK pounds and it was too much. It seems something was wrong with my exchange.,card_payment_wrong_exchange_rate
How long will this card payment stay pending?,pending_card_payment
My payment has an incorrect exchange rate.,card_payment_wrong_exchange_rate
"The ATM at Metro bank on High St. Kensington didn't return my card, and the bank is now closed. How do I get back a card swallowed by an ATM?",card_swallowed
The funds I transferred are not in my account,balance_not_updated_after_bank_transfer
Can you please advise if there is something wrong with my card? I have had multiple rejections and do not know the reason. Thanks!,declined_card_payment
Can I cancel an order if I haven't received the item yet? And how can I get my money back? Please help. Thanks.,request_refund
Is there a charge for exchanging foreign currencies?,exchange_charge
How do I change my address ?,edit_personal_details
Please list what fiat currencies are supported for both holding and exchanging.,fiat_currency_support
Should i reinstall the payment app?,contactless_not_working
I need a transaction reversed from my account.,transaction_charged_twice
How come my transfer got declined,declined_transfer
What types of fiduciary currencies are supported for tenure and exchange?,fiat_currency_support
Can you tell me why I was charged extra when I withdrew money?,cash_withdrawal_charge
"I'd rather not use my physical card, how can I get a virtual card?",getting_virtual_card
What do I need to do to transfer my paycheck to my account?,receiving_money
"I would like to use the bank transfer feature, but I can't find it. Can you please give me the details?",transfer_into_account
So I just put my top-up into the card and it hasn't changed.,pending_top_up
I was at an ATM and it swallowed my card.,card_swallowed
Can I get my paycheck through here?,receiving_money
How long will my transfer be pending?,pending_transfer
My phone has been lost or stolen,lost_or_stolen_phone
How can I exchange GBP for AUD?,exchange_via_app
How long is my Europe transfer wait?,transfer_timing
I don't know my password anymore.,passcode_forgotten
Can I activate a card in the app?,card_linking
I don't think my transfer wen through. Why?,failed_transfer
Can you help me figure out what is going on with a debit payment that is showing up on my account I am not sure is suppose to be there.,direct_debit_payment_not_recognised
How long does a transfer transaction take?,transfer_timing
Can I have my card activated?,activate_my_card
I just deposited cash to my account and can't find it!,balance_not_updated_after_cheque_or_cash_deposit
Is there a charge or discount if I use a European bank in a top up?,top_up_by_card_charge
What kind of fee is there to top-up my account?,top_up_by_bank_transfer_charge
Why was I not allowed to do a transfer to a beneficiary?,beneficiary_not_allowed
why do I have a pending payment?,pending_card_payment
"My card is stuck in the ATM, what can I do?",card_swallowed
"I just noticed that I supposedly made a payment to a seller a while back. The problem is, I don't recognize the seller. There must be a way to see who it is or track the payment. Can you do that, because I don't remember this transaction?",direct_debit_payment_not_recognised
"I get paid in GBP. Should I configure this and if so, where?",receiving_money
Is there a verification code for top-ups?,verify_top_up
I just initiated a transfer but I'd like to cancel it.,cancel_transfer
I just received my card and I'd like to activate it.,activate_my_card
I can't do any business with this virtual card.,virtual_card_not_working
What do I need to do for a PIN?,get_physical_card
When I made a cash transfer abroad the wrong exchange rate was applied,wrong_exchange_rate_for_cash_withdrawal
I'm not verifying my identity.,why_verify_identity
I just got $20 when I tried to get $100,wrong_amount_of_cash_received
How do I use the app to exchange currencies?,exchange_via_app
After I transferred money the balance remained the same.,balance_not_updated_after_bank_transfer
How do I add a card on to the app?,card_linking
Is there anyway to bypass identity verification?,why_verify_identity
Got only $20 when I tried to withdraw $100.,wrong_amount_of_cash_received
How do I get the Top Up feature on my apple watch working?,apple_pay_or_google_pay
How long does a transfer from the United Kingdom take? I haven't seen it show up yet in my bank account and want to make sure I get the transfer.,balance_not_updated_after_bank_transfer
How long is the transfer?,transfer_timing
Why did withdrawing money cost me extra?,cash_withdrawal_charge
"I seem to have a problem here, I bought something about a 2 weeks ago and just now received the payment back into my account and I've already received the item. Can you tell me what is going on here?",reverted_card_payment?
The transfer I tried to make failed.,failed_transfer
Is it free to send out more cards?,getting_spare_card
I need to get some Euros for my holiday. Am I able to exchange some of my money?,exchange_via_app
What are the exchange rates you assign?,exchange_rate
Is GBP a supported currency?,receiving_money
How many disposable cards can I own?,disposable_card_limits
Is it a good time to exchange?,exchange_rate
What is maximum top up?,top_up_limits
I can't seem to make a standard bank transfer. I have tried at least five times already but none of them are going through. Please tell me what is wrong?,failed_transfer
Does my account have the option to hold multiple currencies?,fiat_currency_support
I added money to the card but the transaction didn't go through,pending_top_up
Do you support fiat currencies?,fiat_currency_support
"Hello, is there any way to double check my card? I have never had issues with withdraws in the past, but this morning on the way to work it was unexpectedly declined.",declined_cash_withdrawal
Will money be added automatically when necessary?,automatic_top_up
Do you charge for physical cards,order_physical_card
"I've use this account all the time, including over this past month, to pay for things from my new place abroad. I'm a really good customer, so why do I suddenly have new fees? I should be rewarded instead of charged more fees.",transfer_fee_charged
Can the card was sen to me be tracked?,card_arrival
How many payments can I make using a virtual card?,disposable_card_limits
How much transactions do I get with a disposable card?,disposable_card_limits
"The ATM would not give me cash,why?",declined_cash_withdrawal
How to receive virtual card?,getting_virtual_card
I tried to charge my card but it was declined. A couple days ago I was able to charge it and it was accepted. Is something wrong? Will you double check for me please?,top_up_failed
A payment in my account was made by someone I don't know,card_payment_not_recognised
The card got declined twice when I tried to use it to buy something online yesterday.,declined_transfer
What fees do you charge for the standard card?,order_physical_card
which identity details are required,why_verify_identity
How long does it take for money to reach my account?,balance_not_updated_after_bank_transfer
"I need a disposable virtual card, how do I get one?",get_disposable_virtual_card
My identity can't be verified for some reason,unable_to_verify_identity
"Hello, I found the card I misplaced and I need to reactive it, how do I do that?",card_linking
Is a SWIFT transfer acceptable?,top_up_by_bank_transfer_charge
Will you accept my other card?,supported_cards_and_currencies
Can I use my apple watch to top up?,apple_pay_or_google_pay
I believe my card has been compromised as there's a cash withdrawal I don't recognize.,cash_withdrawal_not_recognised
The exchange rate you are using is really bad.This can't be the official interbank exchange rate.,card_payment_wrong_exchange_rate
When my card expires what happens to my account?,card_about_to_expire
How do I deposit cash into my account?,top_up_by_cash_or_cheque
can i do a transfer with swift,top_up_by_bank_transfer_charge
Hello. Can you help figure out why the recent transfer from my UK bank account isn't showing up?,balance_not_updated_after_bank_transfer
"If my card is about to expire, do I need to order a new one?",card_about_to_expire
How do I go about changing my PIN?,change_pin
How long does a payment show as pending before i should worry about it?,pending_card_payment
"Someone has stolen my card. Even though I have my card with me, someone just made a 500£ cash withdrawal. Please help as soon as possible.",cash_withdrawal_not_recognised
"I see in the app some cash was withdrawn, but it's not mine.",cash_withdrawal_not_recognised
My account did not allow the transfer.,beneficiary_not_allowed
May I get my salary paid out in a different currency?,receiving_money
"There are multiple instances where you added a fee to the payment, as well as some where you didn't. Do you have an outline of when a fee will be added?",card_payment_fee_charged
What happened to my top-up? It was all done and now it's gone! Are you having problems with your system?,top_up_reverted
Can you help me with proving my identity?,unable_to_verify_identity
I sent a transfer to a friend that needs it urgently. It has already been 2 hours and still hasn't come through to her. How long does it normally take?,transfer_not_received_by_recipient
Why didn't the ATM give me my money?,declined_cash_withdrawal
How would I use a disposable card?,get_disposable_virtual_card
Where do I order a virtual card?,getting_virtual_card
i have been trying to top up my account with a check but it won't work,top_up_by_cash_or_cheque
Is there a fee to order a physical card?,order_physical_card
Money is not in recipients account.,transfer_not_received_by_recipient
