text,label
"My money is gone. I had topped up recently and saw it was there and went through, but now it's disappeared, what is happening?",top_up_reverted
Where'd the rest of my cash go from the ATM,wrong_amount_of_cash_received
What does it mean if my cash withdrawal is pending?,pending_cash_withdrawal
What do I need to do to transfer money with my credit card?,topping_up_by_card
I would like a  physical card sent to me.,order_physical_card
I was just contacted by a seller that let me know they didn't get my money even though I'm very sure it was removed from my account. Now it's back in my account. Get this resolved quickly.,reverted_card_payment?
I got an cancellation error when I was topping up.,top_up_reverted
I bought an item and the exchange rate was wrong.,card_payment_wrong_exchange_rate
The exchange rate for my withdrawal isn't correct and doesn't match the actual exchange rate.,wrong_exchange_rate_for_cash_withdrawal
My transfer is pending.,balance_not_updated_after_bank_transfer
"If someone in a different country sends me money, do I have to pay a fee?",exchange_charge
What steps do I need to take for the identity checking process?,verify_my_identity
Please list the countries you support.,country_support
"I have checked the account information several times to be sure that it is correct, but the in country transfer I did a few days ago still has not appeared! What is the hold up?",transfer_not_received_by_recipient
Do you offer disposable virtual cards too?,get_disposable_virtual_card
My card payment was cancelled.  Why?,reverted_card_payment?
"Hi, My card withdrawal was declined this morning. It was working fine till yesterday. Please check and inform me.",declined_cash_withdrawal
I need to change my pin but I am on the road.,change_pin
There is  a charge I don't recognize.,card_payment_not_recognised
Why is my transfer more expensive than I thought?,transfer_fee_charged
What do I need to do to perform identity checks?,verify_my_identity
I haven't used my card all day but there is a payment showing in the app. Please cancel it!,direct_debit_payment_not_recognised
What do I need to do to correct this failed transfer?,failed_transfer
Seems like my card payment has been cancelled,reverted_card_payment?
Why didn't the ATM give me all my money,wrong_amount_of_cash_received
The ATM cancelled a transaction on me when I was trying to get some cash out.,declined_cash_withdrawal
My card failed to work when I was shopping in a store,declined_card_payment
I attemped a transfer and it didn't go through.,failed_transfer
I need to change my home address.,edit_personal_details
"Hello there, I tried using crypto top up today but it's not working for me, might it be due to the kind of bank I'm using or the country that I'm from?Money is also missing from my account",top_up_reverted
I'm expecting to see a cash withdrawal but I'm still waiting.,pending_cash_withdrawal
Why was my card declined in a shop?,declined_card_payment
Why is it asking me to verify my identity,why_verify_identity
What time will a transfer from the US take?,transfer_timing
How long does it take for a refund to appear?,Refund_not_showing_up
What kind of currencies can I use to add money?,supported_cards_and_currencies
What should I do if I think that someone might be using me card?,compromised_card
I'm having difficulty verifying my identity.,unable_to_verify_identity
"I made a transaction, but I made it to an account I didn't mean to make it to.",cancel_transfer
Can I call to get my card activated?,activate_my_card
I don't see a code anywhere on my top-up card? Where can I find it? I need to verify!,verify_top_up
What countries can I use your services?,country_support
Do I need to order a new card if mine is expiring?,card_about_to_expire
I used foreign currency to buy something and I think the rate applied is incorrect.,card_payment_wrong_exchange_rate
Can I choose between Mastercard and Visa?,visa_or_mastercard
going to need a new card what are the fees and time it takes,card_about_to_expire
What do I owe for a new card?,order_physical_card
I am upset with your service.  Please delete my account.,terminate_account
How old do kids have to be to open an account?,age_limit
I have an unusual payment in my statement,card_payment_not_recognised
I would like to activate my card.,activate_my_card
"Do you not accept crypto transfers from certain places? Because when I tried to do a top up the money just disappeared. Im not sure what to do or what I'm doing wrong, please help.",top_up_reverted
I was under the impression that transfers were going to be free and here I was charged for something I bought overseas!  I don't think this fee is right,transfer_fee_charged
I'm pretty sure something went wrong with my exchange. I changed Russian Ruble to UK pounds and was charged way too much!,card_payment_wrong_exchange_rate
Do I really need to verify my identity?,why_verify_identity
I bought something this morning and the payment is still pending,pending_card_payment
Is there any way to cancel my transfer,cancel_transfer
Can it automatically top up my account?,automatic_top_up
When will my top up go through?,pending_top_up
Who do I call to cancel a transfer?,cancel_transfer
I still haven't seen a refund on my account,Refund_not_showing_up
What methods can I use to add money to my account?,transfer_into_account
I need to know how much it costs to transfer funds.,transfer_fee_charged
What went wrong when I tried to do my transfer?,failed_transfer
"I've been waiting a while for my card, is there a way to know when it will arrive?",card_arrival
"If I will be traveling, is there a way to auto top-up my card on certain days?",automatic_top_up
I could only take the amount of money that was available to me which was less then I expected.,wrong_amount_of_cash_received
are SWIFT transfers an option?,top_up_by_bank_transfer_charge
I would like to transfer money into my account.,transfer_into_account
Do you know why my card payment has been declined?,declined_card_payment
"I made a transfer and the receiver said they haven't actually received the right amount, but it's a bit less. Now I have to transfer more money to make up for the missing bit. Can you please alert me about this, what has been going on?",transfer_fee_charged
What is the youngest someone can be to open an account?,age_limit
Your foreign exchange rate is wrong.,card_payment_wrong_exchange_rate
My address is incorrect on my file.,edit_personal_details
"I'm trying to move money from my account to elsewhere, but it's giving me an error message.",declined_transfer
"I made a transfer and the receiver said an amount was received, but not exactly the same as the right amount. I now have to transfer more to get the remainder to the receiver. Can you alert me about this. What's been happening?",transfer_fee_charged
I do not know what this cash withdrawal is,cash_withdrawal_not_recognised
What kind of costs are involved for exchanging currency?,exchange_charge
I ordered a card and would like to know how to track the delivery progress of it.,card_arrival
What is this extra pound charge for?,extra_charge_on_statement
Why doesn't my balance reflect my transfer,balance_not_updated_after_bank_transfer
What does it mean if my payment has been reverted?,reverted_card_payment?
Can I return an item?,request_refund
My card has gone missing.,lost_or_stolen_card
Will I see fees from adding money with an international card?,top_up_by_card_charge
How do I see my card in the app?,card_linking
Can I add a card that I just found (again) to the app?,card_linking
My password doesn't work.,passcode_forgotten
How do I make my transfer go through,declined_transfer
What documentation is needed for the identity check?,verify_my_identity
I have a trip coming up and want to add money automatically.,automatic_top_up
"Hi, It's urgent, please freeze my card. As someone has withdrawn money using my card in odd remote town. Since i have not done this withdrawal. Do it fast.",cash_withdrawal_not_recognised
How does someone else top up my account,topping_up_by_card
The app wouldn't accept my top up.,top_up_reverted
Why did I only receive this much currency?,wrong_exchange_rate_for_cash_withdrawal
Where are cards delivered to?,order_physical_card
I believe a wrong exchange rate was applied towards a cash transaction I made abroad.,wrong_exchange_rate_for_cash_withdrawal
I need several disposable cards made per day.,disposable_card_limits
Do you receive SWIFT transfers?,top_up_by_bank_transfer_charge
Can I withdraw money from another bank and transfer it into my empty account?,transfer_into_account
How can my friend send me money?,receiving_money
How does on apply fora refund on an item he ordered? I ordere an item and have not received it yet so i want to cancel it and get a refund,request_refund
Why is it taking so long for my pending transaction to post as cleared?,pending_transfer
why is there a fee for a payment on my card?,card_payment_fee_charged
I transferred money and was charged and want to know why.,transfer_fee_charged
My top-up was rejected by an app.,top_up_failed
Where can I find the verification code for the card top-up?,verify_top_up
Can you tell my why my funds transfer did not work properly?,failed_transfer
I still don't have my card after 2 weeks.  What should I do?,card_arrival
I didn't cancel my top-up.,top_up_reverted
Why do we need to verify top-ups?,verify_top_up
I was contacted by a seller with a message that they never received my money. I am 100% sure it was taken from my account so I definitely need this sorted out soon.,reverted_card_payment?
Why did I have to pay extra because I paid with my card?,card_payment_fee_charged
Why did a transaction I made charge me $1?,extra_charge_on_statement
In which stores can I shop with this card?,card_acceptance
I think my transfer failed. What do I do now?,failed_transfer
Why am i to verify the top-ups?,verify_top_up
My transaction to pay for an item was returned to my account.,reverted_card_payment?
A Bank ATM did not give my card back. What do I do now?,card_swallowed
How will I know when I get my refund?,Refund_not_showing_up
How can I alteration my PIN?,change_pin
Why hasn't my card been delivered?,card_arrival
"My card will expire soon, When do I need to order a new one?",card_about_to_expire
I tried updating my balance by cheque yesterday but it doesn't seem to be working. Shouldn't that be faster? Please check my account something has gone wrong there.,balance_not_updated_after_cheque_or_cash_deposit
What is the process for using my credit card to transfer money?,topping_up_by_card
There has been a transfer pending in my account and I wanted to know how long it is going to take to go  through.,pending_transfer
How can I receive my salary in another currency?,receiving_money
"I just saw a charge for a cash withdrawal that I made! ATM withdrawals have always been free in the past, so why is there suddenly a charge? What is it going to cost me now?",cash_withdrawal_charge
I need to reverse a transaction,cancel_transfer
Can someone assist me with activating my new card?,activate_my_card
How long until my card is delivered?,card_delivery_estimate
Do you offer a discount for those who perform frequent currency exchanges?,exchange_charge
Why did the ATM machine fail to give me a cash withdrawal?,declined_cash_withdrawal
I made a transfer and was charged extra. Why?,transfer_fee_charged
Am I charged a fee to transfer funds?,transfer_fee_charged
My transfer failed.  Help!,failed_transfer
What source do my fund come from?,verify_source_of_funds
I have been charged a fee for paying with card,card_payment_fee_charged
Is there an age limit to when my child can use these services?,age_limit
How long should a cheque deposit take to show? My account hasn't updated and I want to make sure everything is okay.,balance_not_updated_after_cheque_or_cash_deposit
"The transfer keeps failing , I tried to transfer some money to friends this morning but it keeps getting rejected for some reason, Would you please check the issue?",failed_transfer
How do I link a new card to an existing one?,card_linking
Using an ATM caused me to incur an additional fee. Why?,cash_withdrawal_charge
The expiration date of my card is approaching .,card_about_to_expire
Can you tell me if a credit/refund is coming from a seller? I asked for refund directly from them and am still waiting. It's been a week now and i still havn't seen my refund yet.,Refund_not_showing_up
My top-up failed to go through.,top_up_failed
Could you please help me figure out why the seller has not received their money after I sent it.,pending_transfer
My card wasn't working in a shop,declined_card_payment
"Is there something wrong with your website? I tried topping up my account and it's been close to two hours now and it's still at ""pending"" for some reason. I just joined with you guys and this is the first attempt at this, so maybe I'm wrong, but shouldn't this be instant?",pending_top_up
Can I open a bank account for my newborn baby?,age_limit
"I'm expecting a large refund from a store I returned merchandise to recently.  They say they have sent the money but I don't see it in my account, can you help.",Refund_not_showing_up
I haven't received my pin,get_physical_card
I can't verify identity through the app.,unable_to_verify_identity
I see that I have been charged multiple times for the same transaction.,transaction_charged_twice
Can I reactivate my lost card that I found this morning in my jacket pocket?,card_linking
I thought crypto top up with something you offered and it does not appear that it's working even though the money has disappeared out of my account. Can you tell me what's going on?,top_up_reverted
Is my card accepted everywhere?,card_acceptance
Where do you deliver cards to?,order_physical_card
Help me figure out how to link the new card.,card_linking
I cannot find my credit card.,lost_or_stolen_card
Balance hasn't been updated following a cheque or cash deposit,balance_not_updated_after_cheque_or_cash_deposit
My card seems to not be working at all.,card_not_working
"Visa and MasterCard, can I get them both?",visa_or_mastercard
Why would a transfer fail?,failed_transfer
What is my card's PIN?,get_physical_card
Is there a way to reset my PIN?,pin_blocked
My card payment has been cancelled,reverted_card_payment?
How much would it cost me for a bank transfer to top up my account?,top_up_by_bank_transfer_charge
What is not accepted in order for me to top up my account?,top_up_by_cash_or_cheque
I made a cash withdrawl and there is a charge.  What is this?,cash_withdrawal_charge
Something is wrong with my top up and I can't see it. How do I find it?,topping_up_by_card
think someone is using my card with permission,compromised_card
Where is the cash deposit I made?,balance_not_updated_after_cheque_or_cash_deposit
Can I get my money back on an item?,request_refund
What do I do if there is a direct debit on my account that shouldn't be there?,direct_debit_payment_not_recognised
My credit card was declined for top-up. Can you see if there is enough funds in my account?,top_up_failed
Why is my transfer pending when I already made it?,pending_transfer
Can you tell me why the card payment came back?,reverted_card_payment?
My credit card got declined for top up! What's going on? Can you check on why it didn't go through?,top_up_failed
What can I do to track the card you sent me?,card_arrival
How do I make sure I don't run out of money on my card while traveling?,automatic_top_up
Will the duplicated payment be refunded?,transaction_charged_twice
Why verify the top-ups?,verify_top_up
How do I freeze my card using the app?,compromised_card
I'd like to provide my daughter with a card - could I get an additional card from my account to give her?,getting_spare_card
I can't find the card PIN.,get_physical_card
"You keep declining my transfers? It's always been working really well so far, but when I tried to buy something just now the card got declined. I tried couple times already but same thing.",declined_transfer
This card payment isn't is recognition.,card_payment_not_recognised
I would like to delete my account please.,terminate_account
I checked on google and the exchange rate you are using is really bad. Can you update it?,card_payment_wrong_exchange_rate
There is an extra 1£ charge on my app. Why did you charge me extra?,extra_charge_on_statement
What transfer methods do you accept?,transfer_into_account
Card activation is not working. What do i do?,activate_my_card
Why isn't a refund showing on my statement?,Refund_not_showing_up
Can friends add to my account,topping_up_by_card
My card was declined today when eating and I need to know what's wrong.,card_not_working
i was charged when i used a us issued card. why and what cards are free to use to add money,top_up_by_card_charge
"Top up my card please, which y'all support?",supported_cards_and_currencies
I don't know my password,passcode_forgotten
I can't get the ATM to give me any cash,declined_cash_withdrawal
I no longer have my phone.,lost_or_stolen_phone
The app does not know it is me.,unable_to_verify_identity
Why do i have an extra fee on my statement?,extra_charge_on_statement
The cash deposit I made this morning has not been credited to my account,balance_not_updated_after_cheque_or_cash_deposit
What I topped up was reverted by the app.,top_up_reverted
how to get card pin?,get_physical_card
What's the maximum amount I can top up my card with please?,top_up_limits
i noticed that the funds were returned to my bank account. What happened?,top_up_reverted
I tried to get cash at some ATM in the city centre earlier but the machine declined my card. I've seen it still shows up as pending in my account. Please cancel it immediately as I definitely have not received that money!,pending_cash_withdrawal
The app won't let me top up my account,top_up_failed
What are the top-up limits?,top_up_limits
My transfer failed to a beneficiary,beneficiary_not_allowed
What age can sign up for services?,age_limit
"I need to delete my account, please.",terminate_account
My passcode won't work.,passcode_forgotten
I can't find the PIN.,get_physical_card
Help me please!  My card was stolen!,lost_or_stolen_card
How much longer is it going to take to get my new card?,card_arrival
Help! I just realised someone has apparently withdrawn money using my card! It's from some odd remote town where I definitely haven't been. Please freeze it immediately!,cash_withdrawal_not_recognised
what is the word?,direct_debit_payment_not_recognised
Where do your cards get delivered to?,order_physical_card
When will you be taking orders for disposable virtual cards?,get_disposable_virtual_card
Why is the payment showing as pending from things I bought this morning?,pending_card_payment
Tell me about verifying top-up,verify_top_up
How can I process a refund for something I purchased?,request_refund
why can't my beneficiary make transactions?,beneficiary_not_allowed
I can't withdraw any money from my account. Ive tried a couple different ATM machines and both of them wouldn't give me my money. What's going on? Is my account frozen or something?,declined_cash_withdrawal
I need to edit the personal details section of my account,edit_personal_details
There is a payment showing as pending and hasn't posted for a few days.  When will it post?,pending_card_payment
"I think I was charged twice, please help!",transaction_charged_twice
"My transfer went through, but it seems to be caught up in a pending status.  This was very important that it got done quickly, can you give me a status update on how long it will take?",pending_transfer
Can you explain what this random $1 charge is?,extra_charge_on_statement
I need immediate assistance in canceling a transfer which was a mistake. Please help me quickly so this does not go through.,cancel_transfer
Do you have info about the card on delivery?,card_arrival
"Do I have to top up in euros if I use a card, or can I use a different currency?",supported_cards_and_currencies
Tell me if there are any top-up limits?,top_up_limits
How do I use a check to top up?,top_up_by_cash_or_cheque
I am quite aggravated that I ordered online almost a month ago and I never got my package and I paid for it. I would really appreciate it if I could get a full refund back now.,request_refund
How long to UK transfers usually take? I made a transfer but it didn't pop up in my history yet. I just want to make sure it went through.,balance_not_updated_after_bank_transfer
There's a payment that isn't mine on my app,card_payment_not_recognised
I tried to do a transfer and it's saying it declined.,declined_transfer
I have an unauthorized transaction on my statement,card_payment_not_recognised
Why is the payment on my card still pending?,pending_card_payment
I did not get the right exchange rate while getting my cash out.,wrong_exchange_rate_for_cash_withdrawal
I need to cancel my recent transfer as soon as possible. I made an error there. Please help before it goes through.,cancel_transfer
Mastercard is preferred to me.,visa_or_mastercard
The app won't let me transfer money to a beneficiary,beneficiary_not_allowed
Just today there was a purchase on my card that wasn't done by me. Can this be reversed and my card be frozen? I can't have this continue!,card_payment_not_recognised
Why do you have the identity check,why_verify_identity
"When I got cash, my exchange rate was wrong.",wrong_exchange_rate_for_cash_withdrawal
My phone is missing or stolen.,lost_or_stolen_phone
"Instead of GBP, how do I exchange for AUD?",exchange_via_app
"I received a refund, however I cannot see it in my account",Refund_not_showing_up
I think my top up is still pending?,pending_top_up
Why did I get a $1 extra fee on the statement?,extra_charge_on_statement
can i top up from a usa credit card,supported_cards_and_currencies
How do I use the app if I don't have my phone with me?,lost_or_stolen_phone
What is the procedure for me to get more cards on my account?,getting_spare_card
Are there any restrictions causing my transfer to be declined?,declined_transfer
Why was my card payment declined?,declined_card_payment
Why was my top-up rejected?,top_up_failed
Why is my app showing me taking money that I did not take out?,cash_withdrawal_not_recognised
I am still waiting for a money transfer to show,pending_transfer
can other people use the app to add money to my account,topping_up_by_card
I made a bank transfer and my account balance did not show it.,balance_not_updated_after_bank_transfer
Can I possibly change my currency to another?,exchange_via_app
I wanted to purchase some crypto. The app will not let me. What's going on here? I really want to make this exchange.,beneficiary_not_allowed
Is getting my identity verified required before I can use my account?,why_verify_identity
There is a Direct Debit that looks suspicious.,direct_debit_payment_not_recognised
How much does it cost for a physical card?,order_physical_card
I made a transfer and the person I transferred the money to didn't receive the right amount? Why did this happen and how do I get the rest of the money to them?,transfer_fee_charged
At what places accept my card?,card_acceptance
There appears to have been a reversion in my top up,top_up_reverted
How can I receive money?,receiving_money
There has been a payment  in the App that has not be done by me.,card_payment_not_recognised
I happened to forget my password,passcode_forgotten
can i go into my app to find my pin,get_physical_card
Do you know the closest ATM?,atm_support
Why does the top-up need verification?,verify_top_up
How many transactions can I do with a disposable card?,disposable_card_limits
Is there any limits I should know about if I'm going to use a disposable virtual card?,disposable_card_limits
Will you be adding more currencies in the future?,fiat_currency_support
Am I going to be charged for topping up by transfer?,top_up_by_bank_transfer_charge
I have to verify my identity. What do I need to do?,verify_my_identity
Why was my account deducted from a seller when I didn't approve of it?,direct_debit_payment_not_recognised
How long do transfers take to go though,balance_not_updated_after_bank_transfer
why hasn't my virtual card arrived?,getting_virtual_card
There is a strange charge on my debit statement,direct_debit_payment_not_recognised
I need a refund?,request_refund
I am seeing in the App a some cash withdrawal that I did not do,cash_withdrawal_not_recognised
Why are you asking so many questions about me?,why_verify_identity
Do I get an actual card?,order_physical_card
do the details of my profile have to match my documents,verify_my_identity
I attempted to get cash in the ATM but it was not authorized,declined_cash_withdrawal
"Even though I made a cash deposit, I am not seeing it in my account.",balance_not_updated_after_cheque_or_cash_deposit
Where do I locate topping up with cash.,top_up_by_cash_or_cheque
The ATM took my card.,card_swallowed
My contactless is non-functional.,contactless_not_working
How do I convert currencies with the app?,exchange_via_app
My money didnt go through after I transferred.,beneficiary_not_allowed
"A WD was just made on my account, but it was not me and I still have my card.  What to do?",cash_withdrawal_not_recognised
My card was not accepted.,declined_card_payment
"I think someone saw my PIN and I am on vacation in Spain, can I change it locally at an ATM?",change_pin
How can I top up with Google Pay?,apple_pay_or_google_pay
Can I have it delivered on the date I need it delivered?,card_delivery_estimate
"My receipt shows an extra charge on my transfer, why is this?",transfer_fee_charged
How long does it take for pending to go through,pending_transfer
can i verify my identity i the app,verify_my_identity
I have a payment that hasn't went through yet.,pending_card_payment
"I don't recognize this payment on my app, I am sure I didn't spend any money there.",card_payment_not_recognised
