text,label
"If I get a transfer from Europe, how long until it is in my account?",transfer_timing
How can I top up my account by bank transfer?,transfer_into_account
I am interested in a Visa or Mastercard. Do you offer them?,visa_or_mastercard
I have been charged for one thing two times.,transaction_charged_twice
why hasnt my card come in yet?,card_arrival
What is the time frame for a transfer from the US?,transfer_timing
I am having to wait for my transfer to be fully processed. It seems to be taking a very long time in the pending phase. What is the normal turn around time that I can expect to see it completed?,pending_transfer
What is the limit on disposable cards?,disposable_card_limits
Please cancel the latest ATM charge on my card as my card was declined earlier today and I did not receive that cash.,pending_cash_withdrawal
i cannot get virtual card to work,virtual_card_not_working
"The day before yesterday, I performed a transfer within the country. It still has not completed. Can you check on that? The account number is definitely correct, as I've checked.",transfer_not_received_by_recipient
I think something went wrong with my exchange between Russian Ruble and UK pounds. I was overcharged during the swap.,card_payment_wrong_exchange_rate
Why did I not get all the cash I asked for?,wrong_amount_of_cash_received
Why was the wrong rate applied when I bought something in a different currency?,card_payment_wrong_exchange_rate
My card hasn't arrived yet. What do I do?,card_arrival
Can I top up using cash?,top_up_by_cash_or_cheque
"Hi. I'm a new customer to your system and I think something isn't working right - or maybe it is. Maybe you can confirm. I tried to top up today (my first time ever) and it's been stuck at ""pending"" for over an hour now. Is it supposed to do this or is there something wrong in the system?",pending_top_up
Why can't I see a recent refund in my statement?,Refund_not_showing_up
I need to get visa and mastercard,visa_or_mastercard
"Hi, My card is getting declined continuously when i am trying to top-up. Request you to look into this issue or tell me any other alternatives.",top_up_failed
Can you tell me the cost of a transfer?,top_up_by_bank_transfer_charge
Can I verify my identity online?,verify_my_identity
My card hasn't shown up yet.,card_arrival
I want to start using my card.,activate_my_card
"I deposited a check yesterday to up my account balance, but that deposit hasn't shown up yet.  It's been a day already!",balance_not_updated_after_cheque_or_cash_deposit
"Why do you keep declining my transfers? It's been working well so far, but when I just tried to buy something, the card got declined. I tried it a few times, but same thing happened every try.",declined_transfer
There is a withdrawal that isn't mind in the app.,cash_withdrawal_not_recognised
It looks like I was charged a withdrawal fee for going to my ATM. Why is that because I haven't been charged previously for doing so?,cash_withdrawal_charge
Supported countries,country_support
How do disposable cards work?,get_disposable_virtual_card
What will I need to verify my identity,verify_my_identity
I have not received the amount of cash i was supposed to.,wrong_amount_of_cash_received
I did a transaction to a wrong account!,cancel_transfer
Why am I not able to get cash from the ATM?,declined_cash_withdrawal
What fees are charged for a physical card?,order_physical_card
"Hey a seller just contacted me that my money didn't come through. It was definitely deducted from my account, but now it appears it's back with me! Sort this out asap please.",reverted_card_payment?
where can i located the auto top up function?,automatic_top_up
Does Apple Watch support the topping-off of my account?,apple_pay_or_google_pay
I transfered my balance a while back.  Why doesn't my account reflect this?,balance_not_updated_after_bank_transfer
Where do I obtain my virtual card?,getting_virtual_card
My card is being declined for a purchase. I bought items before and the card worked. Do you know what the problem is?,reverted_card_payment?
There was a fee charged when I paid with my card.,card_payment_fee_charged
Can I wait for you to send me a new card when mine's about to expire?,card_about_to_expire
I would like to use cash to make a top-up?,top_up_by_cash_or_cheque
"On a card top-up, where can I verify?",verify_top_up
What ATMs will allow me to change my PIN?,change_pin
Why is my card payment still pending?,pending_card_payment
When do you charge fees on accounts? I just saw a charge on my statement.,card_payment_fee_charged
Are there ways to transfer money into my account?,transfer_into_account
I must make several disposable cards per day.,disposable_card_limits
What are the top up charges for US cards?,top_up_by_card_charge
What other methods are there to verify my identity?,why_verify_identity
"I can't see if the transfer I did a couple days ago is in my account yet. I double checked my info before sending, too. Can you check this?",transfer_not_received_by_recipient
Why do I need to verify my funds?,verify_source_of_funds
What information do you need to verify my Source of Funds?,verify_source_of_funds
Why would my top up be cancelled?,top_up_reverted
Can a credit card be used to transfer money?,topping_up_by_card
What's the reason my new card hasn't come?,card_arrival
I don't like your company. Delete my account.,terminate_account
I need help with understanding why my card is not working.,card_not_working
I'm really upset because I made a typo during a transfer and now I've sent money to the wrong account.  I can't fix this with the app.  Please help me immediately!,cancel_transfer
I can't do the verification.,why_verify_identity
I put the wrong pin too many times and now it is blocked. Can you help me unblock it?,pin_blocked
Please provide details on how to top up my account using transfer option,transfer_into_account
I made a mistake when I did a transfer so now what can I do to fix that?,cancel_transfer
is apple pay costly?,apple_pay_or_google_pay
Can i have a virtual card?,getting_virtual_card
I was trying to top-up and my credit card was declined. Can you tell me why?,top_up_failed
I need to know if you will accept my credit card.,supported_cards_and_currencies
Can I reset my PIN if it is blocked?,pin_blocked
The ATM keeps rejecting my Payment. I tried two different ATMs but did not work .Can you please check if everything is okay with my account?,declined_cash_withdrawal
Where can I find my PIN?,get_physical_card
How to unblock my PIN?,pin_blocked
Why does my card continually get declined? I thought I had enough money in there but I've tried several times now and it still isn't working.,declined_transfer
how come i was declined,declined_cash_withdrawal
Will it automatically top-up if there isn't much money left?,automatic_top_up
Why was I charged a fee for a transfer?,transfer_fee_charged
I found my card! Can I link it back into the app?,card_linking
What do you charge for physical cards?,order_physical_card
Why can I not transfer money into my account?,transfer_into_account
is there a fee for swift transfer,top_up_by_bank_transfer_charge
I would appreciate it if I could get an item refunded,request_refund
How can I fix my card if the contactless function didn't work this morning?,contactless_not_working
Why is there a charge on my account for taking out cash?,cash_withdrawal_charge
"I bought something in another currency, but the exchange rate was incorrect.",card_payment_wrong_exchange_rate
Is the verification number on the top up card,verify_top_up
Why was I charged for transferring money?,transfer_fee_charged
I just had a look at my statement. Why have I been changed for using the ATM?,cash_withdrawal_charge
I see a strange payment in my account.,card_payment_not_recognised
Is it possible to use Apple Pay to put money in my account?,apple_pay_or_google_pay
"Why would my transfer be declined? I've checked that I've put in all the right details, but it is still declined.",declined_transfer
Please help me.  I don't know my code to get into the app.,passcode_forgotten
I was charged a fee when buying stuff with my card.,card_payment_fee_charged
Why would I need a disposable card?,get_disposable_virtual_card
"I am unable to activate my card, it won't let me.",activate_my_card
How do I add a card to the app?,card_linking
The passcode isn't working for me.,passcode_forgotten
How much am I allowed to top-up?,top_up_limits
My top-up is taking a very long time to complete.,pending_top_up
What do I do to activate?,activate_my_card
Why is a transfer to a beneficiary not possible?,beneficiary_not_allowed
Is it possible to get both Visa and Mastercard from you?,visa_or_mastercard
I completed I transfer the day before yesterday in this country. The transfer still is not complete. I've checked on the account number multiple times to make sure that it is the right one. Can you check to see what's going on with this?,transfer_not_received_by_recipient
"Now that I have my card, how do I connect it to the app?",card_linking
There was a direct debit I don't recognize.,direct_debit_payment_not_recognised
The transfer I did hasn't arrived,transfer_not_received_by_recipient
I just looked over my statement and I don't recognize the name of a card payment.,card_payment_not_recognised
This is very frustrating. I can't get my card to work on any ATM I try and I've tried 3 of them so far. What's going on? Can you please fix this issue immediately?,declined_cash_withdrawal
"More than one time this week, I have been charged more than once for the same transaction. Please correct the issue and refund the duplicate charges.",transaction_charged_twice
My purchase from this morning still is pending.,pending_card_payment
Why will my transfer not go through?!  Keep getting an error message.,beneficiary_not_allowed
Is it possible to have a discount for exchanging currency frequently?,exchange_charge
I tried to use the ATM today but it would not accept my card.,declined_cash_withdrawal
I made a check deposit but the cash hasn't arrived in my account yet.,balance_not_updated_after_cheque_or_cash_deposit
"My card is broke, what do I do?",card_not_working
My refund doesn't seem to be showing on my statement.,Refund_not_showing_up
Tell me how many transactions I can do with a disposable card.,disposable_card_limits
Can I get information on the identity checks?,verify_my_identity
There is a cash withdrawal transaction that I am unsure of.,cash_withdrawal_not_recognised
"I ordered something ages ago online but it's simply not arriving. I've got enough! Give me back my money, I'm not paying these people.",request_refund
Can I change my PIN abroad?,change_pin
My passcode doesn't seem to be working,passcode_forgotten
Why has my top-up been reverted?,top_up_reverted
Why am I charged a fee for using my card on some purchases?,card_payment_fee_charged
I've tried numerous times to submit a transfer of funds. Why isn't it going through?,beneficiary_not_allowed
Why would the app revert my payment?,reverted_card_payment?
"I wrote a check to the account yesterday to add to my balance, but I don't see the amount of the check reflected anywhere.  Is it being held up for some reason?  I should have seen a new balance by now!",balance_not_updated_after_cheque_or_cash_deposit
"Hi, I want to inquire about my balance. Some cash was deposited and it hasn't updated yet.",balance_not_updated_after_cheque_or_cash_deposit
My transfer to a beneficiary was rejected.,beneficiary_not_allowed
Is there a maximum i can top up?,top_up_limits
What are the restrictions of the disposable cards?,disposable_card_limits
What reasons could cause my top up to be reverted,top_up_reverted
My card stopped working. How do I check if there is a freeze on it?,card_not_working
I sent some money and the receiver can't access it.,transfer_not_received_by_recipient
Why is there a fee for an extra pound in my statement?,extra_charge_on_statement
What are the auto top-up policies?,automatic_top_up
Is it possible to hold money in multiple currencies?,fiat_currency_support
I tried to make a transfer and it failed.,failed_transfer
Why did you revert my top-up?,top_up_reverted
Why isn't my balance updating?  I did a bank transfer and it isn't current.,balance_not_updated_after_bank_transfer
Can I see where my money came from?,verify_source_of_funds
Will you tell me how I am supposed to use the disposable cards?,get_disposable_virtual_card
Card payment declined?,declined_card_payment
I need a few more physical cards.,getting_spare_card
How do I unlock my account after typing in the wrong PIN too many times?,pin_blocked
Will there be additional costs of I make a withdrawal from a local ATM of British pounds? I need some cash to feel comfortable on the journey home,wrong_exchange_rate_for_cash_withdrawal
Do you support all countries?,country_support
The app won't identify me.,unable_to_verify_identity
I purchases several items today. Why are they still showing pending?,pending_card_payment
What is the reason I got rejected for using my disposable virtual card to pay a subscription to the gym?,virtual_card_not_working
Why was I charged for cash withdrawal?,cash_withdrawal_charge
My new card keeps getting declined. I was very excited to use it for the first time today. Why is this doing this?,declined_card_payment
Do I need to set a limit on auto top-up?,automatic_top_up
"Help!  I fear that my card was stolen,",lost_or_stolen_card
still waiting on that card,card_arrival
How do I fix a broken card?,card_not_working
Change currency,exchange_via_app
How can I change my Tholepin ?,change_pin
How do i access the auto top-up option?,automatic_top_up
Please help me.  My card is missing.,lost_or_stolen_card
Why does my top up say still pending when I used my card to do it.,pending_top_up
What countries can I use the card in?,country_support
My order needs to be canceled.,request_refund
The refund isn't showing up on my account.,Refund_not_showing_up
Can I do more than 10 transactions with a disposable card?,disposable_card_limits
I'd like to know where my funds come from.,verify_source_of_funds
Can you tell me where to go to get a disposable virtual card?,get_disposable_virtual_card
I need to update my info.,edit_personal_details
Is there a reason my new card hasn't arrived?,card_arrival
What ATMs is the card okay to use at?,atm_support
There was a canceled payment for my card.,reverted_card_payment?
"I got a transfer fail message, but no explanation of why-- what happened?",failed_transfer
I attempted to get cash in the ATM but I was denied,declined_cash_withdrawal
My transfer was rejected,declined_transfer
the exchange rate on my payment was wrong,card_payment_wrong_exchange_rate
What does it mean when a payment is pending?,pending_card_payment
There is a fee from a transfer that is not supposed to be here!,transfer_fee_charged
I'm noticing a payment/purchase at a company that I don't recognise.,card_payment_not_recognised
Which establishments will accept my card?,card_acceptance
How low does the balance have to be before the system updates?,automatic_top_up
Why can't I get cash out?,declined_cash_withdrawal
Why am I seeing a fee for transferring money?,transfer_fee_charged
"I cannot get to my app, what should I do?",lost_or_stolen_phone
How long does it take for my id to verify?,unable_to_verify_identity
How does it work when I transfer money into my account?,transfer_into_account
My payment has been cancelled,reverted_card_payment?
I can't get the virtual card to work,virtual_card_not_working
When will my top-up happen?,pending_top_up
"Hi, I was at a restaurant later the week and when I went to look at my account I noticed that I got charged twice. I would like to get my money back from one of those transactions.",transaction_charged_twice
"help, lost my card",lost_or_stolen_card
How much can I withdrawal in one month without incurring fees?,cash_withdrawal_charge
Why can't you allow my beneficiary?,beneficiary_not_allowed
"When I tried to pay for my bus ride, the contactless payment wouldn't work. How can I prevent this in the future?",contactless_not_working
I couldn't make a transfer,failed_transfer
Why do I see a random withdrawal in my app?,cash_withdrawal_not_recognised
My wallet was taken and I see that someone is using my card!   Please help me!,cash_withdrawal_not_recognised
What is the base amount for cross-currency exchanges?,exchange_charge
What places can I use my card?,card_acceptance
i live in the US can i still get a card?,country_support
How long with my cash withdrawal stay pending for?,pending_cash_withdrawal
I can't access my account.,passcode_forgotten
I must have entered my PIN wrong.,pin_blocked
Do you happen to do exchanges of EUR?,fiat_currency_support
How long will it take to transfer something to China urgently?,transfer_timing
I tried using my card at multiple vendors and now it's not working.,card_not_working
If I have a physical card can I link it?,card_linking
"I wanted to transfer money to another account, but now I don't have to so I'd like to cancel said transfer. How can I do that?",cancel_transfer
How do I top up on my card?,topping_up_by_card
how do i get a refund for a direct debit payment i didn't make,direct_debit_payment_not_recognised
I got less cash than what I specified at the ATM.,wrong_amount_of_cash_received
"The ATM charged me an extra fee, Why?",cash_withdrawal_charge
How can I tell what the limit is to top-ups?,top_up_limits
How can i get a refund for something i just bought?,request_refund
I am reluctant to use ATMs international because I don't get an accurate exchange rate,wrong_exchange_rate_for_cash_withdrawal
"I deposited cash this morning, but it is not yet available.",balance_not_updated_after_cheque_or_cash_deposit
Do cash withdrawals cost anything?,cash_withdrawal_charge
My new card isn't here and it was issued a week ago.,card_arrival
"I followed the instructions to transfer money using my card, but then the money disappeared and I don't know what happened.",topping_up_by_card
I was trying to purchase some crypto and the app won't allow me to do it. What's the deal with this? I really wanted to complete the exchange.,beneficiary_not_allowed
The exchange rate for the money I took out in a foreign country is wrong.,wrong_exchange_rate_for_cash_withdrawal
My card was confiscated by an ATM. How do I get my card back?,card_swallowed
What is the reason for my beneficiary to be disallowed?,beneficiary_not_allowed
I'm trying to purchase crypto via the app. I haven't been able to get it to go through. Am I doing something wrong?,beneficiary_not_allowed
How can I modify my details?,edit_personal_details
What's going on? I was just recently charged for an ATM withdrawal. I've never seen this charge before and before it's always been free.,cash_withdrawal_charge
I received my salary in GBP. How do I change this to my currency?,receiving_money
My cheque is slow to cash,balance_not_updated_after_cheque_or_cash_deposit
After my card expires what should I do?,card_about_to_expire
I have a friend who needs money as soon as possibly. If I were to transfer it how long will it take to get to her?,transfer_not_received_by_recipient
I am not comfortable verifying my indentity.,why_verify_identity
WHAT IS THE SOLUTION OF THIS PROBLEM,card_arrival
Why is my transfer pending?,pending_transfer
"It looks like someone besides me ordered something with my card, what should I do?",compromised_card
Will I get Visa or MasterCard?,visa_or_mastercard
"If I lost my phone, what steps do I need to take to stop someone from using my account?",lost_or_stolen_phone
What's the right way to activate my card?,activate_my_card
It's been a week since you issued me a card and I still didn't get it. Should I keep waiting?,card_arrival
What is the minimum age required to open an account with your service?,age_limit
Why is there a random payment in my statement?,card_payment_not_recognised
This place has been too much work so I'd just like to close out my account & be done.,terminate_account
What fee will be charged for exchanges?,exchange_charge
I think my phone was stolen. What can I do?,lost_or_stolen_phone
I need more money in my account. Can I add more by transferring?,transfer_into_account
Why is there an uknown charge showing on my account?,card_payment_not_recognised
How long will it take to have my card mailed to me?,card_delivery_estimate
I got charged for with a fee for paying with my card.,card_payment_fee_charged
What is the number of transactions I get with a disposable card?,disposable_card_limits
Do you have a list of exchange rates?,exchange_rate
What systems do you have in place for my security when using my card for everyday purchases?,get_disposable_virtual_card
My passcode was denied.,passcode_forgotten
My app shows a direct debit that isn't mine.,direct_debit_payment_not_recognised
Why was my top up cancelled?,top_up_reverted
How do I track the card you sent me?,card_arrival
What happens if my card expires?,card_about_to_expire
How old do my kids need to be to open an account?,age_limit
My credit card payment has been in pending status for a super long time.  I don't get it.  Why is it like this?  When will it go through?,pending_card_payment
What do you need for my identity check?,verify_my_identity
What do I do if I cannot access the app?,lost_or_stolen_phone
How do I retrieve a trapped card from a ATM?,card_swallowed
My card isn't working,card_not_working
I would like to invalidate my account.  I am very disappointed with your services.,terminate_account
Can I transfer using SWIFT?,top_up_by_bank_transfer_charge
Why is there an extra pound charge that is pending?,extra_charge_on_statement
"Last Saturday, I was charged extra for the exchange rate on my payment. Is something wrong?",card_payment_wrong_exchange_rate
"I do not understand why there is a pending 1£ charge on my statement, I do not recall making this transaction. Can you please tell me what this is about?",extra_charge_on_statement
I made a deposit but it is not showing up in my balance.,balance_not_updated_after_cheque_or_cash_deposit
I think there's a purchase at a store that I didn't go to.,card_payment_not_recognised
The app reverted what I topped up.,top_up_reverted
"I want to block my card or deactivate it or something, it's been stolen and I don't want it misused. I want this handled right away.",lost_or_stolen_card
what is the limit for top-ups?,top_up_limits
The machine gave me the wrong amount of cash.,wrong_amount_of_cash_received
Why is this beneficiary being rejected?,beneficiary_not_allowed
Why am I not able to withdraw cash from this ATM?,declined_cash_withdrawal
I've forgotten my app passcode completely.,passcode_forgotten
What's up with the extra fee I got?,cash_withdrawal_charge
I just moved to the US how do I get a card?,country_support
What's the youngest I can be to open an account?,age_limit
What currencies does google pay top up accept?,apple_pay_or_google_pay
Please help me make a transfer. I keep receiving an error and I'm trying to make the initial mortgage payment for a flat I'm buying. What is the deal here?,failed_transfer
I don't see me 'top up' in my wallet,topping_up_by_card
Can I receive a refund for my item?,request_refund
How can I top up with this cheque I got?,top_up_by_cash_or_cheque
How do I reset the passcode?,passcode_forgotten
Now that I live in the US how can I get a card?,country_support
Balance is not up to date.,balance_not_updated_after_bank_transfer
Why am I being charged for getting cash?,cash_withdrawal_charge
How do I freeze my account?,compromised_card
How long does a top-up take to go through?,pending_top_up
How many countries do you support?,country_support
I don't see my card anywhere in the app.,card_linking
I'd like to use my American Express to place money into my account.,supported_cards_and_currencies
I need to move money from another bank to this account.,transfer_into_account
How can I get my money that I didn't get from the ATM?,wrong_amount_of_cash_received
What kind of fiat currencies are supported for holding and exchange?,fiat_currency_support
How much longer do I have to wait until my transaction is complete? I transferred money to another country many hours ago and the transaction is still pending.,pending_transfer
"I already have one of your cards, how do I link them?",card_linking
How can I stop someone from using my card after I lost it yesterday.,lost_or_stolen_phone
The app doesn't believe its me.,unable_to_verify_identity
How can I get my card out of the damn ATM?,card_swallowed
The refund isn't appearing in my account,Refund_not_showing_up
Do EU transfers happen quickly? I purchased something a few days ago and the seller hasn't received my money yet.,pending_transfer
What is the procedure for an expired card?,card_about_to_expire
How can I know where my card will be accepted?,card_acceptance
What if I need multiple disposable cards?,disposable_card_limits
How can I solve my issue with holding multiple currencies?,fiat_currency_support
The ATM did not allow me to withdraw,declined_cash_withdrawal
My account balance has not gone up even though I just transferred money into it,balance_not_updated_after_bank_transfer
Why isn't this accepting my identity?,unable_to_verify_identity
I don't recognize this debit transaction in my billing statement?,direct_debit_payment_not_recognised
How much does it cost to top up by card?,top_up_by_card_charge
"My card's expiring, what happens now?",card_about_to_expire
Help me verify the card used on a top-up.,verify_top_up
Looking at my account I've noticed a charge that appears to still be in progress. I had attempted to get money out of the machine earlier but the machine seemed to have been broken. I never received my money so will you please look into this for me? I don't want to be charged for money I never actually received.,pending_cash_withdrawal
